{
  "schema_version": 1,
  "area_code_5": "08231",
  "prefecture": "茨城県",
  "municipality": "桜川市",
  "official_home_url": "http://www.city.sakuragawa.lg.jp/",
  "sources": {
    "minutes": {
      "status": "needs_review",
      "adapter": "static",
      "index_url": "https://www.city.sakuragawa.lg.jp/gikai/kaigiroku/",
      "verified_at": null,
      "verified_by": null,
      "evidence": [
        {
          "url": "https://www.city.sakuragawa.lg.jp/gikai/kaigiroku/",
          "observed_on": "http://www.city.sakuragawa.lg.jp/gikai/page002506.html",
          "fetched_at": "2026-08-27T06:08:04Z"
        }
      ],
      "notes": "Observed council minutes index at https://www.city.sakuragawa.lg.jp/gikai/kaigiroku/ (label: )"
    },
    "regulations": {
      "status": "needs_review",
      "adapter": "static",
      "index_url": "https://www.city.sakuragawa.lg.jp/shisei/page002688.html",
      "verified_at": null,
      "verified_by": null,
      "evidence": [
        {
          "url": "https://www.city.sakuragawa.lg.jp/shisei/page002688.html",
          "observed_on": "http://www.city.sakuragawa.lg.jp/shisei/",
          "fetched_at": "2026-08-27T06:07:02Z"
        }
      ],
      "notes": "Observed regulations index at https://www.city.sakuragawa.lg.jp/shisei/page002688.html (label: 桜川市例規集)"
    },
    "budget": {
      "status": "needs_review",
      "adapter": "official_document_index",
      "index_url": "https://www.city.sakuragawa.lg.jp/shisei/yosan_kessan/",
      "verified_at": null,
      "verified_by": null,
      "evidence": [
        {
          "url": "https://www.city.sakuragawa.lg.jp/shisei/yosan_kessan/",
          "observed_on": "http://www.city.sakuragawa.lg.jp/shisei/",
          "fetched_at": "2026-08-27T06:07:02Z"
        }
      ],
      "notes": "Observed budget link at https://www.city.sakuragawa.lg.jp/shisei/yosan_kessan/ (label: 市の予算・決算)"
    },
    "settlement": {
      "status": "needs_review",
      "adapter": "official_document_index",
      "index_url": "https://www.city.sakuragawa.lg.jp/shisei/yosan_kessan/",
      "verified_at": null,
      "verified_by": null,
      "evidence": [
        {
          "url": "https://www.city.sakuragawa.lg.jp/shisei/yosan_kessan/",
          "observed_on": "http://www.city.sakuragawa.lg.jp/shisei/",
          "fetched_at": "2026-08-27T06:07:02Z"
        }
      ],
      "notes": "Observed settlement link at https://www.city.sakuragawa.lg.jp/shisei/yosan_kessan/ (label: 市の予算・決算)"
    }
  }
}
