{
  "schema_version": 1,
  "area_code_5": "40231",
  "prefecture": "福岡県",
  "municipality": "那珂川市",
  "official_home_url": "http://www.city.nakagawa.lg.jp/",
  "sources": {
    "minutes": {
      "status": "ready",
      "adapter": "static",
      "index_url": "http://www.city.nakagawa.lg.jp/site/gikai/kensaku.html",
      "verified_at": "2026-08-27T10:56:19Z",
      "verified_by": "verify --live",
      "evidence": [
        {
          "url": "http://www.city.nakagawa.lg.jp/site/gikai/kensaku.html",
          "observed_on": "http://www.city.nakagawa.lg.jp/site/gikai/",
          "fetched_at": "2026-08-27T04:18:25Z"
        },
        {
          "url": "http://www.city.nakagawa.lg.jp/site/gikai/kensaku.html",
          "observed_on": "http://www.city.nakagawa.lg.jp/site/gikai/kensaku.html",
          "sha256": "b78b4f5af63463aea7c39ff3ba79a7a2d03ff3a7c800c140b5a9c7ef5ac85805",
          "fetched_at": "2026-08-27T09:36:18Z"
        }
      ],
      "notes": "Observed council minutes index at http://www.city.nakagawa.lg.jp/site/gikai/kensaku.html (label: 会議録検索システム)"
    },
    "regulations": {
      "status": "ready",
      "adapter": "g_reiki",
      "base_url": "https://www1.g-reiki.net/city.nakagawa/",
      "verified_at": "2026-08-27T09:36:07Z",
      "verified_by": "verify --live",
      "evidence": [
        {
          "url": "https://www1.g-reiki.net/city.nakagawa/reiki_menu.html",
          "observed_on": "http://www.city.nakagawa.lg.jp/",
          "fetched_at": "2026-08-27T04:18:19Z"
        },
        {
          "url": "https://www1.g-reiki.net/city.nakagawa/reiki_menu.html",
          "observed_on": "https://www1.g-reiki.net/city.nakagawa/",
          "sha256": "065f85618f990d29a0fac9f248a6c1575dd6e367cb1d3935e916a83980cbdd16",
          "fetched_at": "2026-08-27T09:36:07Z"
        }
      ],
      "notes": "Observed g_reiki at https://www1.g-reiki.net/city.nakagawa/reiki_menu.html (label: 例規集)"
    },
    "budget": {
      "status": "not_found",
      "adapter": null,
      "verified_at": null,
      "verified_by": null,
      "evidence": [],
      "notes": "No budget entrance found within page limit"
    },
    "settlement": {
      "status": "not_found",
      "adapter": null,
      "verified_at": null,
      "verified_by": null,
      "evidence": [],
      "notes": "No settlement entrance found within page limit"
    }
  }
}
