{
  "schema_version": 1,
  "area_code_5": "20382",
  "prefecture": "長野県",
  "municipality": "辰野町",
  "official_home_url": "https://www.town.tatsuno.lg.jp/",
  "sources": {
    "minutes": {
      "status": "needs_review",
      "adapter": "static",
      "index_url": "https://www.town.tatsuno.lg.jp/gyosei/soshiki/gikaijimukyoku/choseijoho/1/gikaigijiroku/index.html",
      "verified_at": null,
      "verified_by": null,
      "evidence": [
        {
          "url": "https://www.town.tatsuno.lg.jp/gyosei/soshiki/gikaijimukyoku/choseijoho/1/gikaigijiroku/index.html",
          "observed_on": "https://www.town.tatsuno.lg.jp/gyosei/soshiki/gikaijimukyoku/choseijoho/1/index.html",
          "fetched_at": "2026-08-27T07:07:30Z"
        }
      ],
      "notes": "Observed council minutes index at https://www.town.tatsuno.lg.jp/gyosei/soshiki/gikaijimukyoku/choseijoho/1/gikaigijiroku/index.html (label: 議会議事録)"
    },
    "regulations": {
      "status": "needs_review",
      "adapter": "official_document_index",
      "index_url": "https://kre744.legal-square.com/HAS-Shohin/page/SJSrbLogin.jsf",
      "verified_at": null,
      "verified_by": null,
      "evidence": [
        {
          "url": "https://kre744.legal-square.com/HAS-Shohin/page/SJSrbLogin.jsf",
          "observed_on": "https://www.town.tatsuno.lg.jp/",
          "fetched_at": "2026-08-27T07:06:29Z"
        }
      ],
      "notes": "Observed regulations index at https://kre744.legal-square.com/HAS-Shohin/page/SJSrbLogin.jsf (label: 例規集)"
    },
    "budget": {
      "status": "needs_review",
      "adapter": "official_document_index",
      "index_url": "https://www.town.tatsuno.lg.jp/gyosei/choseijoho/yosan_zaisei/index.html",
      "verified_at": null,
      "verified_by": null,
      "evidence": [
        {
          "url": "https://www.town.tatsuno.lg.jp/gyosei/choseijoho/yosan_zaisei/index.html",
          "observed_on": "https://www.town.tatsuno.lg.jp/gyosei/choseijoho/index.html",
          "fetched_at": "2026-08-27T07:06:44Z"
        },
        {
          "url": "https://www.town.tatsuno.lg.jp/gyosei/choseijoho/yosan_zaisei/index.html",
          "observed_on": "https://www.town.tatsuno.lg.jp/gyosei/choseijoho/yosan_zaisei/index.html",
          "sha256": "566afab754871b15cc6f4aff4e02da10f655a57c166d1e013460f042e65d18e4",
          "fetched_at": "2026-08-27T10:10:04Z"
        }
      ],
      "notes": "Observed budget link at https://www.town.tatsuno.lg.jp/gyosei/choseijoho/yosan_zaisei/index.html (label: 予算・財政) 入口 https://www.town.tatsuno.lg.jp/gyosei/choseijoho/yosan_zaisei/index.html に budget の文書リンク（PDF/XLSX・予算/決算ラベル）が見つからない; 本文に到達できたとは言えない"
    },
    "settlement": {
      "status": "needs_review",
      "adapter": "official_document_index",
      "index_url": "https://www.town.tatsuno.lg.jp/gyosei/choseijoho/yosan_zaisei/index.html",
      "verified_at": null,
      "verified_by": null,
      "evidence": [
        {
          "url": "https://www.town.tatsuno.lg.jp/gyosei/choseijoho/yosan_zaisei/index.html",
          "observed_on": "https://www.town.tatsuno.lg.jp/gyosei/choseijoho/index.html",
          "fetched_at": "2026-08-27T07:06:44Z"
        },
        {
          "url": "https://www.town.tatsuno.lg.jp/gyosei/choseijoho/yosan_zaisei/index.html",
          "observed_on": "https://www.town.tatsuno.lg.jp/gyosei/choseijoho/yosan_zaisei/index.html",
          "sha256": "566afab754871b15cc6f4aff4e02da10f655a57c166d1e013460f042e65d18e4",
          "fetched_at": "2026-08-27T10:10:04Z"
        }
      ],
      "notes": "Observed finance section at https://www.town.tatsuno.lg.jp/gyosei/choseijoho/yosan_zaisei/index.html (label: 予算・財政) 入口 https://www.town.tatsuno.lg.jp/gyosei/choseijoho/yosan_zaisei/index.html に settlement の文書リンク（PDF/XLSX・予算/決算ラベル）が見つからない; 本文に到達できたとは言えない"
    }
  }
}
