{
  "schema_version": 1,
  "area_code_5": "20450",
  "prefecture": "長野県",
  "municipality": "山形村",
  "official_home_url": "http://www.vill.yamagata.nagano.jp/",
  "sources": {
    "minutes": {
      "status": "ready",
      "adapter": "static",
      "index_url": "http://www.vill.yamagata.nagano.jp/government/diet/minutes/",
      "verified_at": "2026-08-27T10:11:21Z",
      "verified_by": "verify --live",
      "evidence": [
        {
          "url": "http://www.vill.yamagata.nagano.jp/government/diet/minutes/",
          "observed_on": "http://www.vill.yamagata.nagano.jp/government/diet/",
          "fetched_at": "2026-08-27T07:19:24Z"
        },
        {
          "url": "http://www.vill.yamagata.nagano.jp/government/diet/minutes/",
          "observed_on": "http://www.vill.yamagata.nagano.jp/government/diet/minutes/",
          "sha256": "98e91aa9d52bea7b02fa4d23e0f9bb58fd9eea8db8951b06e4b9d477fdf0c795",
          "fetched_at": "2026-08-27T10:11:24Z"
        }
      ],
      "notes": "Observed council minutes index at http://www.vill.yamagata.nagano.jp/government/diet/minutes/ (label: 議会議事録)"
    },
    "regulations": {
      "status": "ready",
      "adapter": "g_reiki",
      "base_url": "http://www.vill.yamagata.nagano.jp/contents/reiki_int/",
      "verified_at": "2026-08-27T10:11:11Z",
      "verified_by": "verify --live",
      "evidence": [
        {
          "url": "http://www.vill.yamagata.nagano.jp/contents/reiki_int/reiki_menu.html",
          "observed_on": "http://www.vill.yamagata.nagano.jp/",
          "fetched_at": "2026-08-27T07:17:51Z"
        },
        {
          "url": "http://www.vill.yamagata.nagano.jp/contents/reiki_int/reiki_menu.html",
          "observed_on": "http://www.vill.yamagata.nagano.jp/contents/reiki_int/",
          "sha256": "855b9fa2b625c388e04d45b912d6f5a28806908a9de16e13f0d717cbe40e2dae",
          "fetched_at": "2026-08-27T10:11:17Z"
        }
      ],
      "notes": "Observed g_reiki at http://www.vill.yamagata.nagano.jp/contents/reiki_int/reiki_menu.html (label: 例規集)"
    },
    "budget": {
      "status": "ready",
      "adapter": "official_document_index",
      "index_url": "http://www.vill.yamagata.nagano.jp/government/finance/",
      "verified_at": "2026-08-27T22:59:19Z",
      "verified_by": "verify --live",
      "evidence": [
        {
          "url": "http://www.vill.yamagata.nagano.jp/government/finance/",
          "observed_on": "http://www.vill.yamagata.nagano.jp/government/",
          "fetched_at": "2026-08-27T07:18:16Z"
        },
        {
          "url": "https://www.vill.yamagata.nagano.jp/government/finance/",
          "observed_on": "https://www.vill.yamagata.nagano.jp/government/finance/",
          "sha256": "97a3c424839e458b7eb0f23687374449acce92a4204ed671c0b565499bd7938b",
          "fetched_at": "2026-08-27T10:11:29Z"
        },
        {
          "url": "http://www.vill.yamagata.nagano.jp/government/finance/",
          "observed_on": "http://www.vill.yamagata.nagano.jp/",
          "sha256": "97a3c424839e458b7eb0f23687374449acce92a4204ed671c0b565499bd7938b",
          "fetched_at": "2026-08-27T10:11:29Z"
        },
        {
          "url": "https://www.vill.yamagata.nagano.jp/fs/2/0/0/4/1/0/_/%E4%BB%A4%E5%92%8C%EF%BC%96%E5%B9%B4%E5%BA%A6%E6%99%AE%E9%80%9A%E4%BC%9A%E8%A8%88%E6%B1%BA%E7%AE%97%E3%81%AE%E7%8A%B6%E6%B3%81.pdf",
          "observed_on": "https://www.vill.yamagata.nagano.jp/docs/2142.html",
          "sha256": "66d2f5b3e474347c8ecb200e1cd58e703f0553a910b1fa9b4d2541544ca92e30",
          "fetched_at": "2026-08-27T13:36:36Z"
        }
      ],
      "notes": "deepest_doc=P1。budget文書（%E4%BB%A4%E5%92%8C%EF%BC%96%E5%B9%B4%E5%BA%A6%E6%99%AE%E9%80%9A%E4%BC%9A%E8%A8%88%E6%B1%BA%E7%AE%97%E3%81%AE%E7%8A%B6%E6%B3%81.pdf「令和６年度普通会計決算の状況 (PDF 646KB)」, sha256:66d2f5b3）にて構造マーカー（歳入・歳出・項・一般会計等）を確認済み。"
    },
    "settlement": {
      "status": "ready",
      "adapter": "official_document_index",
      "index_url": "http://www.vill.yamagata.nagano.jp/government/finance/",
      "verified_at": "2026-08-27T13:25:31Z",
      "verified_by": "verify --live",
      "evidence": [
        {
          "url": "http://www.vill.yamagata.nagano.jp/government/finance/",
          "observed_on": "http://www.vill.yamagata.nagano.jp/government/",
          "fetched_at": "2026-08-27T07:18:16Z"
        },
        {
          "url": "https://www.vill.yamagata.nagano.jp/government/finance/",
          "observed_on": "https://www.vill.yamagata.nagano.jp/government/finance/",
          "sha256": "97a3c424839e458b7eb0f23687374449acce92a4204ed671c0b565499bd7938b",
          "fetched_at": "2026-08-27T10:11:29Z"
        },
        {
          "url": "http://www.vill.yamagata.nagano.jp/government/finance/",
          "observed_on": "http://www.vill.yamagata.nagano.jp/",
          "sha256": "97a3c424839e458b7eb0f23687374449acce92a4204ed671c0b565499bd7938b",
          "fetched_at": "2026-08-27T10:11:29Z"
        },
        {
          "url": "https://www.vill.yamagata.nagano.jp/fs/1/8/9/5/3/8/_/%E4%BB%A4%E5%92%8C5%E5%B9%B4%E5%BA%A6%E5%B1%B1%E5%BD%A2%E6%9D%91%E4%B8%8B%E6%B0%B4%E9%81%93%E4%BA%8B%E6%A5%AD%E4%BC%9A%E8%A8%88%E6%B1%BA%E7%AE%97.pdf",
          "observed_on": "https://www.vill.yamagata.nagano.jp/docs/jousui.html",
          "sha256": "4a524e80edeb614c20a849c68f91d113e8439c45177beb3bbf255008ce592b7e",
          "fetched_at": "2026-08-27T13:36:36Z"
        }
      ],
      "notes": "deepest_doc=P1。settlement文書（%E4%BB%A4%E5%92%8C5%E5%B9%B4%E5%BA%A6%E5%B1%B1%E5%BD%A2%E6%9D%91%E4%B8%8B%E6%B0%B4%E9%81%93%E4%BA%8B%E6%A5%AD%E4%BC%9A%E8%A8%88%E6%B1%BA%E7%AE%97.pdf「令和5年度山形村下水道事業会計決算 (PDF 1.09MB)」, sha256:4a524e80）にて構造マーカー（款・項・節・決算額等）を確認済み。"
    }
  }
}
