{
  "schema_version": 1,
  "area_code_5": "05212",
  "prefecture": "秋田県",
  "municipality": "大仙市",
  "official_home_url": "https://www.city.daisen.lg.jp",
  "sources": {
    "minutes": {
      "status": "ready",
      "adapter": "static",
      "index_url": "https://www.city.daisen.lg.jp/genre/administration/council/plenarysession",
      "verified_at": "2026-08-27T11:24:46Z",
      "verified_by": "verify --live",
      "evidence": [
        {
          "url": "https://www.city.daisen.lg.jp/genre/administration/council/plenarysession",
          "observed_on": "https://www.city.daisen.lg.jp/genre/administration",
          "fetched_at": "2026-08-27T07:32:03Z"
        },
        {
          "url": "https://www.city.daisen.lg.jp/genre/administration/council/plenarysession",
          "observed_on": "https://www.city.daisen.lg.jp/genre/administration/council/plenarysession",
          "sha256": "b30f07e127e31ed93e9c7b7ea124fee084f290a1bcdcffbce615725e27e09fc2",
          "fetched_at": "2026-08-27T10:34:35Z"
        }
      ],
      "notes": "Observed council minutes index at https://www.city.daisen.lg.jp/genre/administration/council/plenarysession (label: 本会議会議録)"
    },
    "regulations": {
      "status": "needs_review",
      "adapter": "static",
      "index_url": "https://www.city.daisen.lg.jp/genre/administration/reiki",
      "verified_at": null,
      "verified_by": null,
      "evidence": [
        {
          "url": "https://www.city.daisen.lg.jp/genre/administration/reiki",
          "observed_on": "https://www.city.daisen.lg.jp",
          "fetched_at": "2026-08-27T07:31:06Z"
        }
      ],
      "notes": "Observed regulations index at https://www.city.daisen.lg.jp/genre/administration/reiki (label: 例規)"
    },
    "budget": {
      "status": "needs_review",
      "adapter": "official_document_index",
      "index_url": "https://www.city.daisen.lg.jp/genre/administration/finances/budget",
      "verified_at": null,
      "verified_by": null,
      "evidence": [
        {
          "url": "https://www.city.daisen.lg.jp/genre/administration/finances/budget",
          "observed_on": "https://www.city.daisen.lg.jp/genre/administration",
          "fetched_at": "2026-08-27T07:32:03Z"
        },
        {
          "url": "https://www.city.daisen.lg.jp/genre/administration/finances/budget",
          "observed_on": "https://www.city.daisen.lg.jp/genre/administration/finances/budget",
          "sha256": "4a6e32004066244b57d416662a9301af9ee77f079521221fdce52076341f5194",
          "fetched_at": "2026-08-27T10:34:36Z"
        }
      ],
      "notes": "Observed budget link at https://www.city.daisen.lg.jp/genre/administration/finances/budget (label: 予算) 入口 https://www.city.daisen.lg.jp/genre/administration/finances/budget に budget の文書リンク（PDF/XLSX・予算/決算ラベル）が見つからない; 本文に到達できたとは言えない"
    },
    "settlement": {
      "status": "needs_review",
      "adapter": "official_document_index",
      "index_url": "https://www.city.daisen.lg.jp/genre/administration/finances/settlement",
      "verified_at": null,
      "verified_by": null,
      "evidence": [
        {
          "url": "https://www.city.daisen.lg.jp/genre/administration/finances/settlement",
          "observed_on": "https://www.city.daisen.lg.jp/genre/administration",
          "fetched_at": "2026-08-27T07:32:03Z"
        },
        {
          "url": "https://www.city.daisen.lg.jp/genre/administration/finances/settlement",
          "observed_on": "https://www.city.daisen.lg.jp/genre/administration/finances/settlement",
          "sha256": "961d3eb4aaab0ac59210b303062a8f86fadd41275b4f46ff287bb706309514c2",
          "fetched_at": "2026-08-27T10:34:38Z"
        }
      ],
      "notes": "Observed settlement link at https://www.city.daisen.lg.jp/genre/administration/finances/settlement (label: 決算) 入口 https://www.city.daisen.lg.jp/genre/administration/finances/settlement に settlement の文書リンク（PDF/XLSX・予算/決算ラベル）が見つからない; 本文に到達できたとは言えない"
    }
  }
}
