{
  "schema_version": 1,
  "area_code_5": "42209",
  "prefecture": "長崎県",
  "municipality": "対馬市",
  "official_home_url": "http://www.city.tsushima.nagasaki.jp/",
  "sources": {
    "minutes": {
      "status": "ready",
      "adapter": "static",
      "index_url": "https://www.city.tsushima.nagasaki.jp/gyousei/soshiki/gikaijimukyoku/gikai/kaigiroku/index.html",
      "verified_at": "2026-08-27T09:37:35Z",
      "verified_by": "verify --live",
      "evidence": [
        {
          "url": "https://www.city.tsushima.nagasaki.jp/gyousei/soshiki/gikaijimukyoku/gikai/kaigiroku/index.html",
          "observed_on": "https://www.city.tsushima.nagasaki.jp/gyousei/soshiki/gikaijimukyoku/gikai/index.html",
          "fetched_at": "2026-08-27T05:23:36Z"
        },
        {
          "url": "https://www.city.tsushima.nagasaki.jp/gyousei/soshiki/gikaijimukyoku/gikai/kaigiroku/index.html",
          "observed_on": "https://www.city.tsushima.nagasaki.jp/gyousei/soshiki/gikaijimukyoku/gikai/kaigiroku/index.html",
          "sha256": "51b012d8ee2981c3067d816130d2200e9c4c48ce8237aba1c61bc71a5073b24e",
          "fetched_at": "2026-08-27T09:37:37Z"
        }
      ],
      "notes": "Observed council minutes index at https://www.city.tsushima.nagasaki.jp/gyousei/soshiki/gikaijimukyoku/gikai/kaigiroku/index.html (label: 会議録)"
    },
    "regulations": {
      "status": "ready",
      "adapter": "g_reiki",
      "base_url": "http://www.city.tsushima.nagasaki.jp/section/reiki_int/",
      "verified_at": "2026-08-27T09:37:25Z",
      "verified_by": "verify --live",
      "evidence": [
        {
          "url": "http://www.city.tsushima.nagasaki.jp/section/reiki_int/reiki_menu.html",
          "observed_on": "https://www.city.tsushima.nagasaki.jp/gyousei/index.html",
          "fetched_at": "2026-08-27T06:06:18Z"
        },
        {
          "url": "http://www.city.tsushima.nagasaki.jp/section/reiki_int/reiki_menu.html",
          "observed_on": "http://www.city.tsushima.nagasaki.jp/section/reiki_int/",
          "sha256": "6bf21d2f5a00ab317eb9e17ed21b16a502bf38be656ff211f8696d34530ddde7",
          "fetched_at": "2026-08-27T09:37:31Z"
        }
      ],
      "notes": "Observed g_reiki at http://www.city.tsushima.nagasaki.jp/section/reiki_int/reiki_menu.html (label: 例規集)"
    },
    "budget": {
      "status": "needs_review",
      "adapter": "official_document_index",
      "index_url": "https://www.city.tsushima.nagasaki.jp/gyousei/shisei/yosan_kessan/index.html",
      "verified_at": null,
      "verified_by": null,
      "evidence": [
        {
          "url": "https://www.city.tsushima.nagasaki.jp/gyousei/shisei/yosan_kessan/index.html",
          "observed_on": "https://www.city.tsushima.nagasaki.jp/gyousei/shisei/index.html",
          "fetched_at": "2026-08-27T06:06:45Z"
        },
        {
          "url": "https://www.city.tsushima.nagasaki.jp/gyousei/shisei/yosan_kessan/index.html",
          "observed_on": "https://www.city.tsushima.nagasaki.jp/gyousei/shisei/yosan_kessan/index.html",
          "sha256": "7bd781ef9ecce3464848536fb21b0aa14c225c778e17d86b7938361d9538e751",
          "fetched_at": "2026-08-27T09:37:40Z"
        }
      ],
      "notes": "Observed budget link at https://www.city.tsushima.nagasaki.jp/gyousei/shisei/yosan_kessan/index.html (label: 予算・決算) 入口 https://www.city.tsushima.nagasaki.jp/gyousei/shisei/yosan_kessan/index.html に budget の文書リンク（PDF/XLSX・予算/決算ラベル）が見つからない; 本文に到達できたとは言えない 入口 https://www.city.tsushima.nagasaki.jp/gyousei/shisei/yosan_kessan/index.html に budget の文書リンク（PDF/XLSX・予算/決算ラベル）が見つからない; 本文に到達できたとは言えない 入口 https://www.city.tsushima.nagasaki.jp/gyousei/shisei/yosan_kessan/index.html に budget の文書リンク（PDF/XLSX・予算/決算ラベル）が見つからない; 本文に到達できたとは言えない"
    },
    "settlement": {
      "status": "needs_review",
      "adapter": "official_document_index",
      "index_url": "https://www.city.tsushima.nagasaki.jp/gyousei/shisei/yosan_kessan/index.html",
      "verified_at": null,
      "verified_by": null,
      "evidence": [
        {
          "url": "https://www.city.tsushima.nagasaki.jp/gyousei/shisei/yosan_kessan/index.html",
          "observed_on": "https://www.city.tsushima.nagasaki.jp/gyousei/shisei/index.html",
          "fetched_at": "2026-08-27T06:06:45Z"
        },
        {
          "url": "https://www.city.tsushima.nagasaki.jp/gyousei/shisei/yosan_kessan/index.html",
          "observed_on": "https://www.city.tsushima.nagasaki.jp/gyousei/shisei/yosan_kessan/index.html",
          "sha256": "7bd781ef9ecce3464848536fb21b0aa14c225c778e17d86b7938361d9538e751",
          "fetched_at": "2026-08-27T09:37:40Z"
        }
      ],
      "notes": "Observed settlement link at https://www.city.tsushima.nagasaki.jp/gyousei/shisei/yosan_kessan/index.html (label: 予算・決算) 入口 https://www.city.tsushima.nagasaki.jp/gyousei/shisei/yosan_kessan/index.html に settlement の文書リンク（PDF/XLSX・予算/決算ラベル）が見つからない; 本文に到達できたとは言えない 入口 https://www.city.tsushima.nagasaki.jp/gyousei/shisei/yosan_kessan/index.html に settlement の文書リンク（PDF/XLSX・予算/決算ラベル）が見つからない; 本文に到達できたとは言えない 入口 https://www.city.tsushima.nagasaki.jp/gyousei/shisei/yosan_kessan/index.html に settlement の文書リンク（PDF/XLSX・予算/決算ラベル）が見つからない; 本文に到達できたとは言えない"
    }
  }
}
