{
  "schema_version": 1,
  "area_code_5": "43424",
  "prefecture": "熊本県",
  "municipality": "小国町",
  "official_home_url": "https://www.town.kumamoto-oguni.lg.jp/",
  "sources": {
    "minutes": {
      "status": "needs_review",
      "adapter": "static",
      "index_url": "https://www.town.kumamoto-oguni.lg.jp/ogunitowngikai/gikai_kaigiroku",
      "verified_at": null,
      "verified_by": null,
      "evidence": [
        {
          "url": "https://www.town.kumamoto-oguni.lg.jp/ogunitowngikai/gikai_kaigiroku",
          "observed_on": "https://www.town.kumamoto-oguni.lg.jp/index.php",
          "fetched_at": "2026-08-27T05:40:49Z"
        }
      ],
      "notes": "Observed council minutes index at https://www.town.kumamoto-oguni.lg.jp/ogunitowngikai/gikai_kaigiroku (label: 定例・臨時会 会議録)"
    },
    "regulations": {
      "status": "needs_review",
      "adapter": "g_reiki",
      "base_url": "https://www1.g-reiki.net/town.kumamoto-oguni/",
      "verified_at": null,
      "verified_by": null,
      "evidence": [
        {
          "url": "https://www1.g-reiki.net/town.kumamoto-oguni/reiki_menu.html",
          "observed_on": "https://www1.g-reiki.net/town.kumamoto-oguni/reiki_menu.html",
          "fetched_at": "2026-08-27T05:41:07Z"
        }
      ],
      "notes": "Verified vendor regulations probe at https://www1.g-reiki.net/town.kumamoto-oguni/reiki_menu.html for 小国町"
    },
    "budget": {
      "status": "not_found",
      "adapter": null,
      "verified_at": null,
      "verified_by": null,
      "evidence": [],
      "notes": "No budget entrance found within page limit"
    },
    "settlement": {
      "status": "not_found",
      "adapter": null,
      "verified_at": null,
      "verified_by": null,
      "evidence": [],
      "notes": "No settlement entrance found within page limit"
    }
  }
}
