{
  "schema_version": 1,
  "area_code_5": "45431",
  "prefecture": "宮崎県",
  "municipality": "美郷町",
  "official_home_url": "http://www.town.miyazaki-misato.lg.jp/",
  "sources": {
    "minutes": {
      "status": "not_found",
      "adapter": null,
      "verified_at": null,
      "verified_by": null,
      "evidence": [],
      "notes": "No council minutes entrance found within page limit"
    },
    "regulations": {
      "status": "needs_review",
      "adapter": "static",
      "index_url": "http://www.town.miyazaki-misato.lg.jp/list00213.html",
      "verified_at": null,
      "verified_by": null,
      "evidence": [
        {
          "url": "http://www.town.miyazaki-misato.lg.jp/list00213.html",
          "observed_on": "http://www.town.miyazaki-misato.lg.jp/",
          "fetched_at": "2026-08-27T06:33:09Z"
        }
      ],
      "notes": "Observed regulations index at http://www.town.miyazaki-misato.lg.jp/list00213.html (label: 例規集)"
    },
    "budget": {
      "status": "needs_review",
      "adapter": "official_document_index",
      "index_url": "http://www.town.miyazaki-misato.lg.jp/list00495.html",
      "verified_at": null,
      "verified_by": null,
      "evidence": [
        {
          "url": "http://www.town.miyazaki-misato.lg.jp/list00495.html",
          "observed_on": "http://www.town.miyazaki-misato.lg.jp/",
          "fetched_at": "2026-08-27T06:33:09Z"
        },
        {
          "url": "https://www.town.miyazaki-misato.lg.jp/list00495.html",
          "observed_on": "https://www.town.miyazaki-misato.lg.jp/list00495.html",
          "sha256": "ecf6343a5619f4611295969d51bfd3345fa6690ad7bf6bd23eb9effb4cffa4cf",
          "fetched_at": "2026-08-27T09:40:11Z"
        }
      ],
      "notes": "Observed budget link at http://www.town.miyazaki-misato.lg.jp/list00495.html (label: 予算) 入口 https://www.town.miyazaki-misato.lg.jp/list00495.html に budget の文書リンク（PDF/XLSX・予算/決算ラベル）が見つからない; 本文に到達できたとは言えない 入口 https://www.town.miyazaki-misato.lg.jp/list00495.html に budget の文書リンク（PDF/XLSX・予算/決算ラベル）が見つからない; 本文に到達できたとは言えない"
    },
    "settlement": {
      "status": "needs_review",
      "adapter": "official_document_index",
      "index_url": "https://www.town.miyazaki-misato.lg.jp/kiji0031195/index.html",
      "verified_at": null,
      "verified_by": null,
      "evidence": [
        {
          "url": "https://www.town.miyazaki-misato.lg.jp/kiji0031195/index.html",
          "observed_on": "http://www.town.miyazaki-misato.lg.jp/list00106.html",
          "fetched_at": "2026-08-27T06:33:56Z"
        },
        {
          "url": "https://www.town.miyazaki-misato.lg.jp/kiji0031195/index.html",
          "observed_on": "https://www.town.miyazaki-misato.lg.jp/kiji0031195/index.html",
          "sha256": "76b2091e7202a21e850ae5f4ce77517e120229d8f3db65f0c6901e12f0857d72",
          "fetched_at": "2026-08-27T09:40:13Z"
        }
      ],
      "notes": "Observed settlement link at https://www.town.miyazaki-misato.lg.jp/kiji0031195/index.html (label: 財政状況（令和6年度決算）について) 入口 https://www.town.miyazaki-misato.lg.jp/kiji0031195/index.html に settlement の文書リンク（PDF/XLSX・予算/決算ラベル）が見つからない; 本文に到達できたとは言えない 入口 https://www.town.miyazaki-misato.lg.jp/kiji0031195/index.html に settlement の文書リンク（PDF/XLSX・予算/決算ラベル）が見つからない; 本文に到達できたとは言えない"
    }
  }
}
