{
  "schema_version": 1,
  "area_code_5": "21604",
  "prefecture": "岐阜県",
  "municipality": "白川村",
  "official_home_url": "https://www.vill.shirakawa.lg.jp/",
  "sources": {
    "minutes": {
      "status": "not_found",
      "adapter": null,
      "verified_at": null,
      "verified_by": null,
      "evidence": [],
      "notes": "No council minutes entrance found within page limit"
    },
    "regulations": {
      "status": "not_found",
      "adapter": null,
      "verified_at": null,
      "verified_by": null,
      "evidence": [],
      "notes": "No regulations entrance found within page limit"
    },
    "budget": {
      "status": "not_found",
      "adapter": null,
      "verified_at": null,
      "verified_by": null,
      "evidence": [],
      "notes": "No budget entrance found within page limit"
    },
    "settlement": {
      "status": "not_found",
      "adapter": null,
      "verified_at": null,
      "verified_by": null,
      "evidence": [],
      "notes": "No settlement entrance found within page limit"
    }
  }
}
