{
  "schema_version": 1,
  "area_code_5": "17407",
  "prefecture": "石川県",
  "municipality": "中能登町",
  "official_home_url": "http://www.town.nakanoto.ishikawa.jp/",
  "sources": {
    "minutes": {
      "status": "not_found",
      "adapter": null,
      "verified_at": null,
      "verified_by": null,
      "evidence": [],
      "notes": "No council minutes entrance found within page limit"
    },
    "regulations": {
      "status": "ready",
      "adapter": "g_reiki",
      "base_url": "https://www1.g-reiki.net/nakanoto/",
      "verified_at": "2026-08-27T10:06:14Z",
      "verified_by": "verify --live",
      "evidence": [
        {
          "url": "https://www1.g-reiki.net/nakanoto/reiki_menu.html",
          "observed_on": "https://www1.g-reiki.net/nakanoto/reiki_menu.html",
          "fetched_at": "2026-08-27T06:23:55Z"
        },
        {
          "url": "https://www1.g-reiki.net/nakanoto/reiki_menu.html",
          "observed_on": "https://www1.g-reiki.net/nakanoto/",
          "sha256": "1251de80a2b586152bb8c48273807064ba2a0bdd236f2f0627337d8d9a7ee865",
          "fetched_at": "2026-08-27T10:06:24Z"
        }
      ],
      "notes": "Verified vendor regulations probe at https://www1.g-reiki.net/nakanoto/reiki_menu.html for 中能登町"
    },
    "budget": {
      "status": "needs_review",
      "adapter": "official_document_index",
      "index_url": "https://www.town.nakanoto.ishikawa.jp/administrative_information/4/2/index.html",
      "verified_at": null,
      "verified_by": null,
      "evidence": [
        {
          "url": "https://www.town.nakanoto.ishikawa.jp/administrative_information/4/2/index.html",
          "observed_on": "https://www.town.nakanoto.ishikawa.jp/administrative_information/index.html",
          "fetched_at": "2026-08-27T06:21:14Z"
        },
        {
          "url": "https://www.town.nakanoto.ishikawa.jp/administrative_information/4/2/index.html",
          "observed_on": "https://www.town.nakanoto.ishikawa.jp/administrative_information/4/2/index.html",
          "sha256": "ac09d14a5301aa88fdb23c8309a950992ec18889460e5fb525c33a2644a25229",
          "fetched_at": "2026-08-27T10:06:53Z"
        }
      ],
      "notes": "Observed budget link at https://www.town.nakanoto.ishikawa.jp/administrative_information/4/2/index.html (label: 予算) 入口 https://www.town.nakanoto.ishikawa.jp/administrative_information/4/2/index.html に budget の文書リンク（PDF/XLSX・予算/決算ラベル）が見つからない; 本文に到達できたとは言えない 入口 https://www.town.nakanoto.ishikawa.jp/administrative_information/4/2/index.html に budget の文書リンク（PDF/XLSX・予算/決算ラベル）が見つからない; 本文に到達できたとは言えない"
    },
    "settlement": {
      "status": "needs_review",
      "adapter": "official_document_index",
      "index_url": "https://www.town.nakanoto.ishikawa.jp/administrative_information/4/1/index.html",
      "verified_at": null,
      "verified_by": null,
      "evidence": [
        {
          "url": "https://www.town.nakanoto.ishikawa.jp/administrative_information/4/1/index.html",
          "observed_on": "https://www.town.nakanoto.ishikawa.jp/administrative_information/index.html",
          "fetched_at": "2026-08-27T06:21:14Z"
        },
        {
          "url": "https://www.town.nakanoto.ishikawa.jp/administrative_information/4/1/index.html",
          "observed_on": "https://www.town.nakanoto.ishikawa.jp/administrative_information/4/1/index.html",
          "sha256": "d31038a493a40cbd84b7a2338ce4f86d08ff948976f8cb7dca774e6b37ae4050",
          "fetched_at": "2026-08-27T10:06:54Z"
        }
      ],
      "notes": "Observed settlement link at https://www.town.nakanoto.ishikawa.jp/administrative_information/4/1/index.html (label: 決算) 入口 https://www.town.nakanoto.ishikawa.jp/administrative_information/4/1/index.html に settlement の文書リンク（PDF/XLSX・予算/決算ラベル）が見つからない; 本文に到達できたとは言えない 入口 https://www.town.nakanoto.ishikawa.jp/administrative_information/4/1/index.html に settlement の文書リンク（PDF/XLSX・予算/決算ラベル）が見つからない; 本文に到達できたとは言えない"
    }
  }
}
