{
  "schema_version": 1,
  "area_code_5": "46203",
  "prefecture": "鹿児島県",
  "municipality": "鹿屋市",
  "official_home_url": "https://www.city.kanoya.lg.jp/",
  "sources": {
    "minutes": {
      "status": "ready",
      "adapter": "static",
      "index_url": "https://www.city.kanoya.lg.jp/giji/shise/gikai/gaiyo/kensaku.html",
      "verified_at": "2026-08-27T10:57:43Z",
      "verified_by": "verify --live",
      "evidence": [
        {
          "url": "https://www.city.kanoya.lg.jp/giji/shise/gikai/gaiyo/kensaku.html",
          "observed_on": "https://www.city.kanoya.lg.jp/kouhou/shise/index.html",
          "fetched_at": "2026-08-27T06:35:50Z"
        },
        {
          "url": "https://www.city.kanoya.lg.jp/giji/shise/gikai/gaiyo/kensaku.html",
          "observed_on": "https://www.city.kanoya.lg.jp/giji/shise/gikai/gaiyo/kensaku.html",
          "sha256": "795d2304195f828e678413db521fe3cfea5ae2558b5bbf721578a9632841c3b5",
          "fetched_at": "2026-08-27T09:40:11Z"
        }
      ],
      "notes": "Observed council minutes index at https://www.city.kanoya.lg.jp/giji/shise/gikai/gaiyo/kensaku.html (label: 会議録検索)"
    },
    "regulations": {
      "status": "needs_review",
      "adapter": "g_reiki",
      "base_url": "https://www.city.kanoya.lg.jp/soumu/",
      "verified_at": null,
      "verified_by": null,
      "evidence": [
        {
          "url": "https://www.city.kanoya.lg.jp/soumu/reiki.html",
          "observed_on": "https://www.city.kanoya.lg.jp/kouhou/shise/index.html",
          "fetched_at": "2026-08-27T06:35:50Z"
        }
      ],
      "notes": "Observed g_reiki at https://www.city.kanoya.lg.jp/soumu/reiki.html (label: 例規集)"
    },
    "budget": {
      "status": "needs_review",
      "adapter": "official_document_index",
      "index_url": "https://www.city.kanoya.lg.jp/kouhou/shise/zaise/index.html",
      "verified_at": null,
      "verified_by": null,
      "evidence": [
        {
          "url": "https://www.city.kanoya.lg.jp/kouhou/shise/zaise/index.html",
          "observed_on": "https://www.city.kanoya.lg.jp/kouhou/shise/index.html",
          "fetched_at": "2026-08-27T06:35:50Z"
        },
        {
          "url": "https://www.city.kanoya.lg.jp/kouhou/shise/zaise/index.html",
          "observed_on": "https://www.city.kanoya.lg.jp/kouhou/shise/zaise/index.html",
          "sha256": "e281f3f3e135a1c8aeb3bfca7cba8a8baf687e07e2836b0d920135dd314d3e6e",
          "fetched_at": "2026-08-27T09:40:13Z"
        }
      ],
      "notes": "Observed finance section at https://www.city.kanoya.lg.jp/kouhou/shise/zaise/index.html (label: 財政・監査) 入口 https://www.city.kanoya.lg.jp/kouhou/shise/zaise/index.html に budget の文書リンク（PDF/XLSX・予算/決算ラベル）が見つからない; 本文に到達できたとは言えない"
    },
    "settlement": {
      "status": "needs_review",
      "adapter": "official_document_index",
      "index_url": "https://www.city.kanoya.lg.jp/kouhou/shise/zaise/index.html",
      "verified_at": null,
      "verified_by": null,
      "evidence": [
        {
          "url": "https://www.city.kanoya.lg.jp/kouhou/shise/zaise/index.html",
          "observed_on": "https://www.city.kanoya.lg.jp/kouhou/shise/index.html",
          "fetched_at": "2026-08-27T06:35:50Z"
        },
        {
          "url": "https://www.city.kanoya.lg.jp/kouhou/shise/zaise/index.html",
          "observed_on": "https://www.city.kanoya.lg.jp/kouhou/shise/zaise/index.html",
          "sha256": "e281f3f3e135a1c8aeb3bfca7cba8a8baf687e07e2836b0d920135dd314d3e6e",
          "fetched_at": "2026-08-27T09:40:13Z"
        }
      ],
      "notes": "Observed finance section at https://www.city.kanoya.lg.jp/kouhou/shise/zaise/index.html (label: 財政・監査) 入口 https://www.city.kanoya.lg.jp/kouhou/shise/zaise/index.html に settlement の文書リンク（PDF/XLSX・予算/決算ラベル）が見つからない; 本文に到達できたとは言えない"
    }
  }
}
