{
  "schema_version": 1,
  "area_code_5": "10344",
  "prefecture": "群馬県",
  "municipality": "榛東村",
  "official_home_url": "http://www.vill.shinto.gunma.jp/",
  "sources": {
    "minutes": {
      "status": "not_found",
      "adapter": null,
      "verified_at": null,
      "verified_by": null,
      "evidence": [],
      "notes": "No council minutes entrance found within page limit"
    },
    "regulations": {
      "status": "ready",
      "adapter": "g_reiki",
      "base_url": "https://www1.g-reiki.net/shinto/",
      "verified_at": "2026-08-27T10:18:50Z",
      "verified_by": "verify --live",
      "evidence": [
        {
          "url": "https://www1.g-reiki.net/shinto/reiki_menu.html",
          "observed_on": "http://www.vill.shinto.gunma.jp/",
          "fetched_at": "2026-08-27T06:36:35Z"
        },
        {
          "url": "https://www1.g-reiki.net/shinto/reiki_menu.html",
          "observed_on": "https://www1.g-reiki.net/shinto/",
          "sha256": "cd696b15e866bb6afaef4e252a2d3c33ef7f26d01036abca15834bb21aa81518",
          "fetched_at": "2026-08-27T10:18:59Z"
        }
      ],
      "notes": "Observed g_reiki at https://www1.g-reiki.net/shinto/reiki_menu.html (label: )"
    },
    "budget": {
      "status": "needs_review",
      "adapter": "official_document_index",
      "index_url": "http://www.vill.shinto.gunma.jp/administration/000350/index.html",
      "verified_at": null,
      "verified_by": null,
      "evidence": [
        {
          "url": "http://www.vill.shinto.gunma.jp/administration/000350/index.html",
          "observed_on": "http://www.vill.shinto.gunma.jp/",
          "fetched_at": "2026-08-27T06:36:35Z"
        },
        {
          "url": "https://www.vill.shinto.gunma.jp/administration/000350/index.html",
          "observed_on": "https://www.vill.shinto.gunma.jp/administration/000350/index.html",
          "sha256": "7386ac0e650edba580d9392e8fb826d8adce8653e5aac7db35d99d353a9a71f5",
          "fetched_at": "2026-08-27T10:19:38Z"
        }
      ],
      "notes": "Observed finance section at http://www.vill.shinto.gunma.jp/administration/000350/index.html (label: 行財政) 入口 https://www.vill.shinto.gunma.jp/administration/000350/index.html に budget の文書リンク（PDF/XLSX・予算/決算ラベル）が見つからない; 本文に到達できたとは言えない 入口 https://www.vill.shinto.gunma.jp/administration/000350/index.html に budget の文書リンク（PDF/XLSX・予算/決算ラベル）が見つからない; 本文に到達できたとは言えない"
    },
    "settlement": {
      "status": "needs_review",
      "adapter": "official_document_index",
      "index_url": "http://www.vill.shinto.gunma.jp/administration/000350/index.html",
      "verified_at": null,
      "verified_by": null,
      "evidence": [
        {
          "url": "http://www.vill.shinto.gunma.jp/administration/000350/index.html",
          "observed_on": "http://www.vill.shinto.gunma.jp/",
          "fetched_at": "2026-08-27T06:36:35Z"
        },
        {
          "url": "https://www.vill.shinto.gunma.jp/administration/000350/index.html",
          "observed_on": "https://www.vill.shinto.gunma.jp/administration/000350/index.html",
          "sha256": "7386ac0e650edba580d9392e8fb826d8adce8653e5aac7db35d99d353a9a71f5",
          "fetched_at": "2026-08-27T10:19:38Z"
        }
      ],
      "notes": "Observed finance section at http://www.vill.shinto.gunma.jp/administration/000350/index.html (label: 行財政) 入口 https://www.vill.shinto.gunma.jp/administration/000350/index.html に settlement の文書リンク（PDF/XLSX・予算/決算ラベル）が見つからない; 本文に到達できたとは言えない 入口 https://www.vill.shinto.gunma.jp/administration/000350/index.html に settlement の文書リンク（PDF/XLSX・予算/決算ラベル）が見つからない; 本文に到達できたとは言えない"
    }
  }
}
