{
  "schema_version": 1,
  "area_code_5": "41205",
  "prefecture": "佐賀県",
  "municipality": "伊万里市",
  "official_home_url": "http://www.city.imari.saga.jp/",
  "sources": {
    "minutes": {
      "status": "ready",
      "adapter": "kaigiroku_net",
      "tenant_url": "https://ssp.kaigiroku.net/tenant/imari/SpTop.html",
      "verified_at": "2026-08-20T14:06:46Z",
      "verified_by": "verify --live",
      "evidence": [
        {
          "url": "https://ssp.kaigiroku.net/tenant/imari/SpTop.html",
          "observed_on": "http://www.city.imari.saga.jp/"
        },
        {
          "url": "https://ssp.kaigiroku.net/tenant/imari/SpTop.html",
          "observed_on": "https://ssp.kaigiroku.net/tenant/imari/SpTop.html",
          "sha256": "ba485274e6ac3eb77ee9db9ced49dd445c687a57140ee63df0ad33cc3db93482",
          "fetched_at": "2026-08-20T14:05:41Z"
        }
      ],
      "notes": null
    },
    "regulations": {
      "status": "ready",
      "adapter": "g_reiki",
      "base_url": "http://www1.g-reiki.net/imari/",
      "verified_at": "2026-08-20T13:14:00Z",
      "verified_by": "verify --live",
      "notes": "g_reiki tenant observed via preflight/live recheck; base_url requires live HEAD verification before ingest",
      "evidence": [
        {
          "url": "http://www1.g-reiki.net/imari/reiki_menu.html",
          "observed_on": "http://www.city.imari.saga.jp/"
        },
        {
          "url": "http://www1.g-reiki.net/imari/reiki_menu.html",
          "observed_on": "http://www1.g-reiki.net/imari/",
          "sha256": "0090e25900b67841c4fd37d21a33da40789633392d34093e869cc753295dcedb",
          "fetched_at": "2026-08-20T13:14:04Z"
        }
      ]
    },
    "budget": {
      "status": "not_evaluated",
      "adapter": null,
      "verified_at": null,
      "verified_by": null,
      "evidence": [],
      "notes": null
    },
    "settlement": {
      "status": "not_evaluated",
      "adapter": null,
      "verified_at": null,
      "verified_by": null,
      "evidence": [],
      "notes": null
    }
  }
}
