{
  "schema_version": 1,
  "area_code_5": "39206",
  "prefecture": "高知県",
  "municipality": "須崎市",
  "official_home_url": "http://www.city.susaki.lg.jp/",
  "sources": {
    "minutes": {
      "status": "ready",
      "adapter": "static",
      "index_url": "http://www.city.susaki.lg.jp/life/detail.php?hdnKey=4717",
      "verified_at": "2026-08-27T11:01:17Z",
      "verified_by": "verify --live",
      "evidence": [
        {
          "url": "http://www.city.susaki.lg.jp/life/detail.php?hdnKey=4717",
          "observed_on": "http://www.city.susaki.lg.jp/",
          "fetched_at": "2026-08-27T07:08:06Z"
        },
        {
          "url": "http://www.city.susaki.lg.jp/life/detail.php?hdnKey=4717",
          "observed_on": "http://www.city.susaki.lg.jp/life/detail.php?hdnKey=4717",
          "sha256": "3e165dd004e227e85fae405c4ecee8c0ad0ddd7c741cff5b125cf1d966d717cc",
          "fetched_at": "2026-08-27T09:47:24Z"
        }
      ],
      "notes": "Observed council minutes index at http://www.city.susaki.lg.jp/life/detail.php?hdnKey=4717 (label: 会議録の更新について)"
    },
    "regulations": {
      "status": "ready",
      "adapter": "g_reiki",
      "base_url": "http://www.city.susaki.lg.jp/reiki/",
      "verified_at": "2026-08-27T09:47:10Z",
      "verified_by": "verify --live",
      "evidence": [
        {
          "url": "http://www.city.susaki.lg.jp/reiki/reiki_menu.html",
          "observed_on": "http://www.city.susaki.lg.jp/",
          "fetched_at": "2026-08-27T07:08:06Z"
        },
        {
          "url": "http://www.city.susaki.lg.jp/reiki/reiki_menu.html",
          "observed_on": "http://www.city.susaki.lg.jp/reiki/",
          "sha256": "b3ec5d4cb6eea923cf09931aaaaa602108efdb7bc3583dd8bdfc2e3e4aaa3346",
          "fetched_at": "2026-08-27T09:47:16Z"
        }
      ],
      "notes": "Observed g_reiki at http://www.city.susaki.lg.jp/reiki/reiki_menu.html (label: 須崎市例規集)"
    },
    "budget": {
      "status": "needs_review",
      "adapter": "official_document_index",
      "index_url": "http://www.city.susaki.lg.jp/life/detail.php?hdnKey=3962",
      "verified_at": null,
      "verified_by": null,
      "evidence": [
        {
          "url": "http://www.city.susaki.lg.jp/life/detail.php?hdnKey=3962",
          "observed_on": "http://www.city.susaki.lg.jp/life/list.php?hdnSKBN=B&hdnCat=1100&hdnJPN=%C6%FC%CB%DC%B8%EC&routekbn=A",
          "fetched_at": "2026-08-27T07:08:32Z"
        },
        {
          "url": "https://www.city.susaki.lg.jp/life/detail.php?hdnKey=3962",
          "observed_on": "https://www.city.susaki.lg.jp/life/detail.php?hdnKey=3962",
          "sha256": "0b02683c7e4841fc54b94d033e46a82b962cd8324d0f3076115dbef3d7e82749",
          "fetched_at": "2026-08-27T09:47:27Z"
        }
      ],
      "notes": "Observed budget link at http://www.city.susaki.lg.jp/life/detail.php?hdnKey=3962 (label: 当初予算書) 入口 https://www.city.susaki.lg.jp/life/detail.php?hdnKey=3962 に budget の文書リンク（PDF/XLSX・予算/決算ラベル）が見つからない; 本文に到達できたとは言えない 入口 https://www.city.susaki.lg.jp/life/detail.php?hdnKey=3962 に budget の文書リンク（PDF/XLSX・予算/決算ラベル）が見つからない; 本文に到達できたとは言えない"
    },
    "settlement": {
      "status": "needs_review",
      "adapter": "official_document_index",
      "index_url": "http://www.city.susaki.lg.jp/life/detail.php?hdnKey=2563",
      "verified_at": null,
      "verified_by": null,
      "evidence": [
        {
          "url": "http://www.city.susaki.lg.jp/life/detail.php?hdnKey=2563",
          "observed_on": "http://www.city.susaki.lg.jp/life/list.php?hdnSKBN=B&hdnCat=1100&hdnJPN=%C6%FC%CB%DC%B8%EC&routekbn=A",
          "fetched_at": "2026-08-27T07:08:32Z"
        },
        {
          "url": "https://www.city.susaki.lg.jp/life/detail.php?hdnKey=2563",
          "observed_on": "https://www.city.susaki.lg.jp/life/detail.php?hdnKey=2563",
          "sha256": "f611ca6ab4e59ecc2373df2f01b84f0c1aea3289d463ea4d53999b70330c06c8",
          "fetched_at": "2026-08-27T09:47:30Z"
        }
      ],
      "notes": "Observed finance section at http://www.city.susaki.lg.jp/life/detail.php?hdnKey=2563 (label: 財政状況資料集) 入口 https://www.city.susaki.lg.jp/life/detail.php?hdnKey=2563 に settlement の文書リンク（PDF/XLSX・予算/決算ラベル）が見つからない; 本文に到達できたとは言えない 入口 https://www.city.susaki.lg.jp/life/detail.php?hdnKey=2563 に settlement の文書リンク（PDF/XLSX・予算/決算ラベル）が見つからない; 本文に到達できたとは言えない"
    }
  }
}
