{
  "schema_version": 1,
  "area_code_5": "20205",
  "prefecture": "長野県",
  "municipality": "飯田市",
  "official_home_url": "http://www.city.iida.lg.jp/",
  "sources": {
    "minutes": {
      "status": "needs_review",
      "adapter": "kaigiroku_net",
      "tenant_url": "http://ssp.kaigiroku.net/tenant/iida/SpTop.html",
      "verified_at": null,
      "verified_by": null,
      "evidence": [
        {
          "url": "http://ssp.kaigiroku.net/tenant/iida/SpTop.html",
          "observed_on": "http://www.city.iida.lg.jp/site/assembly/teireikai0809.html",
          "fetched_at": "2026-08-27T06:57:46Z"
        }
      ],
      "notes": "Observed kaigiroku_net at http://ssp.kaigiroku.net/tenant/iida/SpTop.html (label: 会議録検索システム （外部リンク）)"
    },
    "regulations": {
      "status": "not_found",
      "adapter": null,
      "verified_at": null,
      "verified_by": null,
      "evidence": [],
      "notes": "No regulations entrance found within page limit"
    },
    "budget": {
      "status": "needs_review",
      "adapter": "official_document_index",
      "index_url": "http://www.city.iida.lg.jp/life/5/19/99/",
      "verified_at": null,
      "verified_by": null,
      "evidence": [
        {
          "url": "http://www.city.iida.lg.jp/life/5/19/99/",
          "observed_on": "http://www.city.iida.lg.jp/life/5/",
          "fetched_at": "2026-08-27T06:56:18Z"
        }
      ],
      "notes": "Observed budget link at http://www.city.iida.lg.jp/life/5/19/99/ (label: 予算・決算)"
    },
    "settlement": {
      "status": "needs_review",
      "adapter": "official_document_index",
      "index_url": "http://www.city.iida.lg.jp/life/5/19/99/",
      "verified_at": null,
      "verified_by": null,
      "evidence": [
        {
          "url": "http://www.city.iida.lg.jp/life/5/19/99/",
          "observed_on": "http://www.city.iida.lg.jp/life/5/",
          "fetched_at": "2026-08-27T06:56:18Z"
        }
      ],
      "notes": "Observed settlement link at http://www.city.iida.lg.jp/life/5/19/99/ (label: 予算・決算)"
    }
  }
}
