{
  "schema_version": 1,
  "area_code_5": "01215",
  "prefecture": "北海道",
  "municipality": "美唄市",
  "official_home_url": "https://www.city.bibai.hokkaido.jp/",
  "sources": {
    "minutes": {
      "status": "blocked",
      "adapter": null,
      "verified_at": null,
      "verified_by": null,
      "evidence": [
        {
          "url": "https://www.city.bibai.hokkaido.jp/",
          "observed_on": "https://www.city.bibai.hokkaido.jp/"
        }
      ],
      "notes": "official_home robots.txt denied"
    },
    "regulations": {
      "status": "blocked",
      "adapter": null,
      "verified_at": null,
      "verified_by": null,
      "evidence": [
        {
          "url": "https://www.city.bibai.hokkaido.jp/",
          "observed_on": "https://www.city.bibai.hokkaido.jp/"
        }
      ],
      "notes": "official_home robots.txt denied"
    },
    "budget": {
      "status": "blocked",
      "adapter": null,
      "verified_at": null,
      "verified_by": null,
      "evidence": [
        {
          "url": "https://www.city.bibai.hokkaido.jp/",
          "observed_on": "https://www.city.bibai.hokkaido.jp/"
        }
      ],
      "notes": "official_home robots.txt denied"
    },
    "settlement": {
      "status": "blocked",
      "adapter": null,
      "verified_at": null,
      "verified_by": null,
      "evidence": [
        {
          "url": "https://www.city.bibai.hokkaido.jp/",
          "observed_on": "https://www.city.bibai.hokkaido.jp/"
        }
      ],
      "notes": "official_home robots.txt denied"
    }
  }
}
