{
  "schema_version": 1,
  "area_code_5": "46492",
  "prefecture": "鹿児島県",
  "municipality": "肝付町",
  "official_home_url": "http://www.kimotsuki-town.jp/",
  "sources": {
    "minutes": {
      "status": "not_found",
      "adapter": null,
      "verified_at": null,
      "verified_by": null,
      "evidence": [],
      "notes": "No council minutes entrance found within page limit"
    },
    "regulations": {
      "status": "not_found",
      "adapter": null,
      "verified_at": null,
      "verified_by": null,
      "evidence": [],
      "notes": "No regulations entrance found within page limit"
    },
    "budget": {
      "status": "not_found",
      "adapter": null,
      "verified_at": null,
      "verified_by": null,
      "evidence": [],
      "notes": "No budget entrance found within page limit"
    },
    "settlement": {
      "status": "not_found",
      "adapter": null,
      "verified_at": null,
      "verified_by": null,
      "evidence": [],
      "notes": "No settlement entrance found within page limit"
    }
  }
}
